{
    "id": 21,
    "date": "2023-04-19T06:42:51",
    "date_gmt": "2023-04-19T06:42:51",
    "guid": {
      "rendered": "http://localhost/index.php/2023/04/19/my-block-rogerpp-9/",
      "raw": "http://localhost/index.php/2023/04/19/my-block-rogerpp-9/"
    },
    "modified": "2023-04-19T06:42:51",
    "modified_gmt": "2023-04-19T06:42:51",
    "password": "",
    "slug": "my-block-rogerpp-9",
    "status": "publish",
    "type": "wp_block",
    "link": "http://localhost/index.php/2023/04/19/my-block-rogerpp-9/",
    "title": {
      "raw": "My Block rogerpp"
    },
    "content": {
      "raw": "[my-blockpp]",
      "protected": false,
      "block_version": 0
    },
    "template": "",
    "_links": {
      "self": [
        {
          "href": "http://localhost/index.php/wp-json/wp/v2/blocks/21"
        }
      ],
      "collection": [
        {
          "href": "http://localhost/index.php/wp-json/wp/v2/blocks"
        }
      ],
      "about": [
        {
          "href": "http://localhost/index.php/wp-json/wp/v2/types/wp_block"
        }
      ],
      "version-history": [
        {
          "count": 0,
          "href": "http://localhost/index.php/wp-json/wp/v2/blocks/21/revisions"
        }
      ],
      "wp:attachment": [
        {
          "href": "http://localhost/index.php/wp-json/wp/v2/media?parent=21"
        }
      ],
      "wp:action-publish": [
        {
          "href": "http://localhost/index.php/wp-json/wp/v2/blocks/21"
        }
      ],
      "wp:action-unfiltered-html": [
        {
          "href": "http://localhost/index.php/wp-json/wp/v2/blocks/21"
        }
      ],
      "curies": [
        {
          "name": "wp",
          "href": "https://api.w.org/{rel}",
          "templated": true
        }
      ]
    }
  }